<?xml version="1.0" encoding="UTF-8"?>
<xs:schema xmlns:xs="http://www.w3.org/2001/XMLSchema">
	<xs:element name="list">
		<xs:complexType>
			<xs:sequence>
				<xs:element name="npc" maxOccurs="unbounded">
					<xs:complexType>
						<xs:sequence>
							<xs:element name="location" maxOccurs="unbounded" minOccurs="0">
								<xs:complexType>
									<xs:attribute type="xs:normalizedString" name="name" use="required" />
									<xs:attribute type="xs:positiveInteger" name="npcStringId" use="optional" />
									<xs:attribute type="xs:int" name="x" use="required" />
									<xs:attribute type="xs:int" name="y" use="required" />
									<xs:attribute type="xs:int" name="z" use="required" />
									<xs:attribute type="xs:int" name="heading" use="optional" />
									<xs:attribute type="xs:int" name="feeId" use="optional" />
									<xs:attribute type="xs:long" name="feeCount" use="optional" />
								</xs:complexType>
							</xs:element>
						</xs:sequence>
						<xs:attribute type="xs:int" name="id" />
					</xs:complexType>
				</xs:element>
			</xs:sequence>
		</xs:complexType>
	</xs:element>
</xs:schema>