<?xml version="1.0" encoding="UTF-8"?>
<list xmlns:xsi="http://www.w3.org/2001/XMLSchema-instance" xsi:noNamespaceSchemaLocation="../xsd/teleporterData.xsd">
	<npc id="30059"> <!-- Trisha -->
		<teleport type="NORMAL">
			<location npcStringId="1010007" x="83551" y="147945" z="-3395" feeCount="6800" /> <!-- The town of Giran -->
			<location npcStringId="1010049" x="111453" y="219391" z="-3545" feeCount="12000" /> <!-- Heine -->
			<location npcStringId="1010005" x="-14608" y="123920" z="-3128" feeCount="3400" /> <!-- The Town of Gludio -->
			<location npcStringId="1010199" x="148015" y="-55293" z="-2733" feeCount="71000" /> <!-- Town of Goddard -->
			<location npcStringId="1010200" x="43823" y="-47760" z="-796" feeCount="57000" /> <!-- Town of Rune -->
			<location npcStringId="1010574" x="87130" y="-143514" z="-1291" feeCount="88000" /> <!-- Town of Schuttgart -->
			<location npcStringId="1010023" x="146798" y="25796" z="-2012" feeCount="52000" /> <!-- Town of Aden -->
			<location npcStringId="1010013" x="82958" y="53213" z="-1495" feeCount="33000" /> <!-- Town of Oren -->
			<location npcStringId="1010001" x="-113443" y="256656" z="-1504" feeCount="17000" /> <!-- Talking Island Village -->
			<location npcStringId="1010614" x="5106" y="126916" z="-3659" feeCount="760" /> <!-- Cruma Marshlands -->
			<location npcStringId="1010116" x="17232" y="114186" z="-3439" feeCount="2300" /> <!-- Cruma Tower -->
			<location npcStringId="1010113" x="47382" y="111278" z="-2099" feeCount="1700" /> <!-- Fortress of Resistance -->
			<location npcStringId="1010111" x="545" y="179163" z="-3425" feeCount="1500" /> <!-- Plains of Dion -->
			<location npcStringId="1010599" x="34475" y="188095" z="-2971" feeCount="2900" /> <!-- Bee Hive -->
			<location npcStringId="1010115" x="60374" y="164301" z="-2851" feeCount="3900" /> <!-- Tanor Canyon -->
		</teleport>
		<teleport type="NOBLES_TOKEN">
			<!-- TODO: done me -->
		</teleport>
		<teleport type="NOBLES_ADENA">
			<!-- TODO: done me -->
		</teleport>
	</npc>
</list>